<?xml version="1.0" encoding="UTF-8"?>
<!--
To change this license header, choose License Headers in Project Properties.
To change this template file, choose Tools | Templates
and open the template in the editor.
-->

<!--
    TODO define vocabulary identification data
    PUBLIC ID  : -//vendor//vocabulary//EN
    SYSTEM ID  : http://server/path/__NAME__
-->

<!-- TODO define your own vocabulary/syntax. Example follows:  -->
<!ELEMENT voters (voter)+>
<!ELEMENT voter (fname,mname,lname,fathername,dob,age,gender,mobile,email)>
<!ELEMENT fname (#PCDATA)>
<!ELEMENT mname (#PCDATA)>
<!ELEMENT lname (#PCDATA)>
<!ELEMENT fathername (#PCDATA)>
<!ELEMENT dob (#PCDATA)>
<!ELEMENT age (#PCDATA)>
<!ELEMENT gender (#PCDATA)>
<!ELEMENT mobile (#PCDATA)>
<!ELEMENT email (#PCDATA)>
<!ATTLIST voter voterid CDATA #REQUIRED>
